CANDIDATO,CARGO,PONTUACAO INICIAL,PRESENCA,PRIVILEGIOS,PARTICIPACAO,PROCESSOS,OUTROS,QUALIDADE,PONTUACAO,DISPESA,UF
jose francisco paes landim (paes landim),Deputado Federal - PTB,200,-25,-45,0,0,-10,-69,51,1356242,PI
maria aparecida borghetti (cida borghetti),Deputado Federal - PROS,200,15,20,0,0,-10,1,226,1243757,PR
paulo fernando dos santos (paulao),Deputado Federal - PT,200,10,50,0,0,20,-7,273,663043,AL
antonio eustaquio andrade ferreira (antonio andrade),Deputado Federal - PMDB,200,10,0,0,-25,0,-141,44,908151,MG
raimundo sabino castelo branco maues (sabino castelo branco),Deputado Federal - PTB,-,-,-,-,-,-,-,NR,804540,AM
iraja silvestre filho (iraja abreu),Deputado Federal - PSD,200,-75,15,0,-25,10,-4,121,1551691,TO
atila freitas lira (atila lira),Deputado Federal - PSB,200,-15,55,0,0,-30,-137,73,650724,PI
ronaldo ramos caiado (ronaldo caiado),Deputado Federal - DEM,200,5,-15,10,-100,0,166,266,2381031,GO
carlos humberto mannato (manato),Deputado Federal - SDD,200,20,-30,0,0,0,-73,117,483347,ES
randolph frederich rodrigues alves (randolfe rodrigues),Senador - PSOL,200,Nao disponivel,-15,0,0,10,-17,178,189365,AP
edmar de souza arruda (edmar arruda),Deputado Federal - PSC,200,0,10,10,0,0,30,250,2221475,PR
raimundo coimbra junior (junior coimbra),Deputado Federal - PMDB,200,20,0,0,-100,20,63,203,791779,TO
jose barroso pimentel (jose pimentel),Senador - PT,200,Nao disponivel,-20,0,0,10,-123,67,4073323,CE
francisco de assis carvalho goncalves (assis carvalho),Deputado Federal - PT,-,-,-,-,-,-,-,NR,437445,PI
adrian mussi ramos (adrian),Deputado Federal - PMDB,200,-20,30,0,-100,10,35,155,1810423,RJ
flavia carreiro albuquerque morais (flavia morais),Deputado Federal - PDT,200,40,10,0,-25,10,1,236,2885311,GO
arthur de oliveira maia da silva (arthur oliveira maia),Deputado Federal - SDD,200,-10,10,0,-25,-20,59,214,528257,BA
onofre santo agustini (onofre santo agostini),Deputado Federal - PSD,200,80,10,0,-100,-10,52,232,642105,SC
celso maldaner (celso maldaner),Deputado Federal - PMDB,-,-,-,-,-,-,-,NR,514554,SC
onyx dornelles lorenzoni (onyx lorenzoni),Deputado Federal - DEM,200,-5,-40,0,0,0,72,227,1060233,RS
joao felipe de souza leao (joao leao),Deputado Federal - PP,200,-35,5,0,0,0,-67,103,841084,BA
arnaldo calil pereira jardim (arnaldo jardim),Deputado Federal - PPS,200,15,-25,0,0,10,85,285,2447385,SP
alexandre jose dos santos (alexandre santos),Deputado Federal - PMDB,200,0,0,0,-100,0,-39,61,1306770,RJ
fernando destito francischini (fernando francischini),Deputado Federal - SDD,200,-25,15,0,0,0,27,217,557122,PR
gilberto jose spier vargas (pepe vargas),Deputado Federal - PT,200,35,15,0,0,0,-150,100,412163,RS
manuela pinto vieira d'avila (manuela d'avila),Deputado Federal - PCdoB,200,-65,-20,10,0,0,-5,120,840496,RS
rodrigo felinto ibarra epitacio maia (rodrigo maia),Deputado Federal - DEM,200,-15,-15,0,0,-20,97,247,1804063,RJ
ana amelia de lemos (ana amelia),Senador - PP,200,Nao disponivel,60,10,0,20,-128,162,2643526,RS
jose renan vasconcelos calheiros (renan calheiros),Senador - PMDB,-,Nao disponivel,-,-,-,-,-,NR,5015840,AL
ricardo de rezende ferraco (ricardo ferraco),Senador - PMDB,200,Nao disponivel,30,0,0,-20,70,280,3650694,ES
miguel correa da silva junior (miguel correa),Deputado Federal - PT,200,-100,-15,0,0,10,-5,90,1368485,MG
jorginho dos santos mello (jorginho mello),Deputado Federal - PR,200,20,10,0,0,0,28,258,289996,SC
lincoln diniz portela (lincoln portela),Deputado Federal - PR,200,85,-35,20,-125,-10,-26,109,954725,MG
sergio zveiter (sergio zveiter),Deputado Federal - PSD,200,-40,75,-10,0,0,55,280,861933,RJ
marcos montes cordeiro (marcos montes),Deputado Federal - PSD,-,-,-,-,-,-,-,NR,1705911,MG
amir francisco lando (amir lando),Deputado Federal - PMDB,200,-115,70,0,0,20,45,220,365887,RO
rui costa dos santos (rui costa),Deputado Federal - PSDB,200,15,80,0,-50,20,-2,263,1031948,BA
jose nobre guimaraes (jose guimaraes),Deputado Federal - PT,-,-,-,-,-,-,-,NR,831030,CE
augusto rodrigues coutinho de melo (augusto coutinho),Deputado Federal - SDD,200,40,5,0,-50,0,-22,173,949993,PE
roberto requiao de mello e silva (roberto requiao),Senador - PMDB,200,Nao disponivel,10,10,-50,20,2,192,2039379,PR
